T1799_001_0001	首楞嚴經疏序大佛頂密因了義首楞嚴經者乃竺乾之洪範法苑之寶典也
T1799_001_0002	昔能仁以出震五天獨尊三界假金輪而啟物現玉毫而應世
T1799_001_0003	觀四生之受苦也惠濟庶物愍群機之未悟也力垂善誘於是俯仰至理述宣微言闢大慈之門廓真如之海以為一切諸法唯依妄念而起一切眾生不出因緣而有乃知生死輪轉貪欲為本修證常樂禪慧為宗
T1799_001_0004	則斯經也可以辯識諸魔破滅七趣謂止及觀修圓教妙明之心發真歸源證上乘至極之說懿其般剌譯其義房相筆其文
T1799_001_0005	今江吳釋璿師學識兼高辯才無礙以是經典為時教於一代分妙理於十門功濟大千道傳不二瞪目合手以明妄毀相泯心以會宗
T1799_001_0006	信受則為世津梁開悟則入佛知見乃顯經以住疏因疏以明理故可以開前疑而決後滯披迷雲而覩惠日然後知色空無異同歸實際生佛靡殊不離方寸隨志抂外護慚無內
T1799_001_0007	學因獲覽閱輒述序引歸依法寶幸精究於真詮讚揚佛乘願普霑於勝果者已
T1799_001_0008	大宋天聖八年青龍庚午孟冬二十一日辛丑道齋東軒序
T1799_001_0009	譯經三藏朝散大夫試鴻臚卿光梵大師賜紫惟淨謹上書于中丞閣下近蒙以新製首楞嚴經疏序特賜寵示者
T1799_001_0010	鴻儒大士嘉讚寶乘淺學緇流叨窺法句身心適悅種智增明頂奉依歸不任慶幸
T1799_001_0011	竊以大佛頂如來密因修證了義諸菩薩萬行首楞嚴經者菩薩行門諸佛心印開有為即塵沙妙用歸無相即法界真源
T1799_001_0012	不有不空絕名相於言罤之外現因示果分階位於神化之中
T1799_001_0013	境不礙心惑不礙智七大之性大無所待八還之法還無所從
T1799_001_0014	所以了真如心息虛妄本起方便慧宣祕密言萬法以之圓融諸佛以之自在入不二之二諦悟不空之三空偉矣真宗不可思議
T1799_001_0015	聿有高士著述疏章煥決祕詮簡談佛旨恭惟中丞入佛知見解法因緣學佛修行袪拂有空之病宣法性相融明起滅之端
T1799_001_0016	為護法城作不請友高製序引恢闡教乘永代作程長冥示炬
T1799_001_0017	惟淨夙承道顧忝翫奇文佩戴恩私不任抃躍不宣惟淨頓首
T1799_001_0018	稽首我大師十方調御尊佛頂首楞嚴大覺如來藏圓明諸聖眾上首龍尊王常闢大慈門救攝眾生者
T1799_001_0019	願垂加護我顯說妙難思普共諸含靈速證真如海
T1799_001_0020	將釋此經十門分別一教起因緣二藏乘分攝三教義分齊四所被機宜五能詮體性六所詮宗趣七教迹前後八傳譯時年九通釋名題十別解文義
T1799_001_0021	初中二一總二別總者謂詶因酬請顯理度生一代教興皆由此矣
T1799_001_0022	若原佛本意唯為一大事因緣欲令眾生開示悟入佛之知見
T1799_001_0023	雖三車通許唯賜白牛但為一乘無三及二也別者有十故說此經
T1799_001_0024	一為克示真三昧故謂阿難遭難蓋無真定故請諸佛得成菩提
T1799_001_0025	妙奢摩他三摩禪那最初方便及佛告許云有三摩提名大佛頂
T1799_001_0026	首楞嚴王具足萬行十方如來一門超出妙莊嚴路至於再請
T1799_001_0027	責己將謂惠我偈讚希有等乃至如來諷歎名金剛王
T1799_001_0028	如幻三昧勅說圓通文殊揀顯指三世佛同此一門
T1799_001_0029	道場加行成就聖位立此經名破滅七趣辨識諸魔皆為此也
T1799_001_0030	二為廣破諸妄執故謂阿難執妄迷真匿王執常為斷七處徵詰
T1799_001_0031	三疑拒諍佛再語云若汝執悋分別覺觀為汝心等
T1799_001_0032	故約心見二門隨執廣破此之執相不離人法也三為開顯妙明心故
T1799_001_0033	謂阿難初請三昧佛先審問發心既陳愛見之源全迷真實之體
T1799_001_0034	遂云眾生無始生死相續皆由不知常住真心此真妙明即是菩提涅槃元清淨體
T1799_001_0035	故阿難自責不知寂常如來許可發妙明性先就心見二門
T1799_001_0036	乍徵乍顯後約三科七大分明顯會令於法法咸見性常
T1799_001_0037	俱遍俱融含攝無礙眾皆領悟自知心遍十方諸所有物皆即菩提妙體
T1799_001_0038	元明心遍含裹十虛身土虛空了無所得唯一本妙常住不滅
T1799_001_0039	洎滿慈疑於有相慶喜再責因緣佛隨開示令得知見矣
T1799_001_0040	四為決斷眾疑網故謂佛顯示真見阿難隨見疑生
T1799_001_0041	或縮斷離身因緣自爾和合非合執相疑性諸大遍圓滅妄生妄成真不真
T1799_001_0042	修無常因獲常住果疑網既眾佛隨斷之矣五為辨析修行門
T1799_001_0043	故謂佛廣示藏體慶喜深解現前舉喻天王賜與華屋
T1799_001_0044	雖知所賜將入無門已悉多聞不逮修習故請問云
T1799_001_0045	從何攝伏疇昔攀緣入佛知見佛舉二義決定以為發覺
T1799_001_0046	初心謂止及觀斯為要也初令以湛旋妄成不生滅
T1799_001_0047	次令審詳煩惱知根降伏一根既反餘根自旋諸妄銷亡
T1799_001_0048	不真何待六為分別邪正行故謂阿難已悟修行後代罔知邪正
T1799_001_0049	雖期正道多陷邪宗水灌漏巵若為取滿慶喜請云
T1799_001_0050	眾生去佛漸遠邪師說法至多欲令心入佛乘遠魔無退
T1799_001_0051	佛舉四種明誨諸聖同途戒根不虧定慧可據如其不切清禁禪慧洪深
T1799_001_0052	鬼屬魔民斯難逭免祈進却步誠可悲夫七為顯呪功能勝故
T1799_001_0053	謂慶喜難在登伽如來遣呪往救承力雖至密言闕聞
T1799_001_0054	況能潛護根門防閑宿習齋戒不稟而自備果證不遠而可得
T1799_001_0055	消難獲利自行化他因人果人靡不由此而辨其事也
T1799_001_0056	八為證入有階降故謂理絕修證事存階漸偏一則病空
T1799_001_0057	有圓通則融真俗故不損寂滅而建立諸位阿難知機為請
T1799_001_0058	如來就行開示始從漸次終乎極果於無生忍中立五十七位
T1799_001_0059	不斷而斷惑障必亡非證而證神用斯備豈同魔外都無位次耶
T1799_001_0060	文云是種種地皆以金剛觀察如幻十種深喻奢摩他中
T1799_001_0061	用諸如來毘婆舍那清淨修證漸次深入耳九為廣示諸魔境故
T1799_001_0062	謂修禪觀人靡不有初而鮮克有終者蓋不諳其魔境妄生取著
T1799_001_0063	不了唯心遂派諸道佛慈無緣不問自說觀中破陰
T1799_001_0064	每陰十種五十境界分析邪源末代修禪免為所惑
T1799_001_0065	十為究盡妄想源故謂五陰諸經皆說未聞五妄想成
T1799_001_0066	今明破一陰時出一妄想破則從麁至細起則自細現麁
T1799_001_0067	其之根源唯一識陰識陰無體但是圓常文云湛入合湛歸識邊際
T1799_001_0068	既知五陰咸是妄想五陰攝法何所不該論云一切諸法唯依妄念而有差別
T1799_001_0069	若離心念則無一切境界之相也由斯十意而說此經
T1799_001_0070	二藏乘分攝者謂三藏之中修多羅攝二藏之中菩薩藏攝若此攝彼則兼該二三
T1799_001_0071	持戒證果有小乘故徵難辨析最明顯故諸乘之中一乘所攝若此攝彼亦該諸乘
T1799_001_0072	十二分中契經方廣二分所攝攝彼如前三教義分齊者
T1799_001_0073	依賢首大師二義分別一約教詮法通局顯分齊謂以義分教
T1799_001_0074	教類有五一小乘教但說我空縱少說法空亦不明顯
T1799_001_0075	但依六識三毒建立染淨根本未盡法源故多諍論
T1799_001_0076	二大乘始教亦名分教但說諸法皆空未盡大乘法理故名為始
T1799_001_0077	但說一切法相有不成佛故名為分三大乘終教亦名實教
T1799_001_0078	說如來藏隨緣成阿梨耶識緣起無性一切皆如定性二乘無性闡提悉當成佛
T1799_001_0079	方盡大乘至極之說故名為終以稱實理故名為實
T1799_001_0080	四大乘頓教總不說法相唯辨真性亦無八識差別之相
T1799_001_0081	呵教勸離毀相泯心但一念不生即名為佛不依地位漸次故說為頓
T1799_001_0082	五一乘圓教所說唯是法界性海圓融緣起無礙相即相入帝網重重主伴無盡也
T1799_001_0083	若於五中顯此經分齊正唯終教兼於頓圓若將此經與五教互相攝者
T1799_001_0084	五唯後三攝此此總攝彼諸教二約法生起本末顯分齊
T1799_001_0085	依起信論明諸染法本末五重論中初唯一心為本源
T1799_001_0086	二依一心開二門一心真如門所謂心性不生不滅
T1799_001_0087	二心生滅門謂依如來藏與生滅合名阿梨耶識三依此識明二義
T1799_001_0088	一覺義謂心體離念等二不覺義謂不如實知真如法
T1799_001_0089	一不覺心動等四依後義生三細一依不覺故心動名業相
T1799_001_0090	二依動故能見名轉相三依見故境界妄現名現相
T1799_001_0091	五依最後生六麁一智相依境分別也即法執俱生
T1799_001_0092	二相續相依智起念不斷即法執分別三執取相心起著故
T1799_001_0093	即我執俱生四計名字相我執分別上四皆惑五起業相業也
T1799_001_0094	六業繫苦相報也若以諸宗就此五重顯分齊者謂人天唯齊業報
T1799_001_0095	小乘齊後四麁法相極於三細終頓圓通詮本末方窮
T1799_001_0096	初一心源初一心源即此經常住真心性淨明體經標此心為宗本故
T1799_001_0097	一切因果世界微塵因心成故二根本中說為無始
T1799_001_0098	菩提涅槃元明體故第一重約見約心或破或會至於備歷三科七大
T1799_001_0099	咸言妙真如性等即心真如門經喻瞪目合手眚見燈光性明圓故
T1799_001_0100	因明發性識精元明性一切心等即生滅門第二重滿慈致疑
T1799_001_0101	佛舉本覺明妙性覺必明妄為明覺覺非所明因明立所等
T1799_001_0102	即本覺不覺也了然自知發真歸元覺迷迷滅等即始覺也第三重
T1799_001_0103	三相四輪晦昧為空空晦暗中結暗為色等即三細第四重
T1799_001_0104	引起塵勞煩惱聚緣內搖趣外奔逸業果眾生二種相續等
T1799_001_0105	即後五麁第五重由是此經具詮本末學者備覽足見幽深
T1799_001_0106	四所被機宜者依圓覺疏略有二種初料揀後普收
T1799_001_0107	初謂樂著名相以文為解者繫滯行位高推聖境者情尚於空觸
T1799_001_0108	言賓無者自恃天真輕厭進習者固執先聞擔麻棄金者如上皆非其器反上即皆是器
T1799_001_0109	後普收一切眾生皆有佛性俱得聞之無不獲益謂宿種深者悟入淺者信解
T1799_001_0110	都無種者亦皆熏成圓頓種性如華嚴經食金剛喻
T1799_001_0111	若約五性正被菩薩性及不定性兼為餘性作遠因緣三聚之中為正定聚令增妙行為不定聚令修信心為邪定人作遠因緣也
T1799_001_0112	五能詮體性者略作四門一隨相門復二一聲名句文體體用假實二相資故二通攝所詮體若不詮義文非教故
T1799_001_0113	二唯識門前二不離識所變故然有本質影像之異
T1799_001_0114	三歸性門此識無體唯真如故四無礙門心境理事交徹相攝以一心法有二門故
T1799_001_0115	六所詮宗趣者即有通別初謂統論佛教因緣為宗以佛聖教自淺至深說一切法不出因緣二字
T1799_001_0116	若佛滅後賢聖弟子相承傳習通大小乘宗途有五如起信疏別明此經者
T1799_001_0117	又有總別總以心境空遍計如蛇鬼經云如虛空華本無所有
T1799_001_0118	又經云妄為色空及與聞見寂依他如影像等經云當處出生隨處滅盡等
T1799_001_0119	藏性圓滿由空寂故圓滿成實經云此見及緣元是菩提妙淨明體等
T1799_001_0120	凡聖平等為宗下云迷悟死生了不可得又聖凡無二路
T1799_001_0121	又生死涅槃皆即狂勞等令修行者忘情由悟宗故下云即汝心中狂性自歇旋流無妄等佛由情忘故經云歇即菩提即同如來等
T1799_001_0122	觀行速成文云方便易成就為趣又以前趣為宗令惑業消滅三緣斷故三因不生
T1799_001_0123	永絕輪迴若得妙發三摩提者則妙常寂有無二無無二亦滅
T1799_001_0124	起大神用不須天眼自然觀見等安樂身心快然獲大安隱自在一為無量小中現大等為趣別有五對一教義二事理三境行四行寂五寂用
T1799_001_0125	皆初宗後趣此五亦是從前起後漸漸相由也若以要言之不出解行修證
T1799_001_0126	初解如來藏為宗行首楞嚴為趣謂佛許示真修却約心見徵解故次修此真定為宗證彼藏體為趣
T1799_001_0127	故下請云雖獲大宅要因門入等七教迹前後者佛說此經非謂一時頓說說必前後
T1799_001_0128	集者約類總為一部謂佛初說匿王在座敘外致疑破彼斷見後至阿難疑問七趣舉瑠璃王誅釋種姓善星比丘妄說法空二俱生身陷入地獄瑠璃豈非匿王之子
T1799_001_0129	王死為嗣方誅瞿曇族姓豈有事之未形而預致問耶
T1799_001_0130	故知此經非一時說若以文義往定即法華後涅槃前也
T1799_001_0131	經文明指耶輸受記持地證經以義往推序歎聲聞非約小行應身無量度脫眾生法華已前無此歎故
T1799_001_0132	聲聞入實法華已前亦無顯露今經有故各說圓通
T1799_001_0133	諸小乘者皆敘本時或述今遇盡證圓妙法華前無應知在後
T1799_001_0134	然又不唱入滅之期定涅槃前二經同部此經居中俱醍醐味無所疑也
T1799_001_0135	八傳譯時年下云大唐神龍元年乙巳歲五月二十三日中天竺沙門般剌蜜帝於廣州制止道場譯
T1799_001_0136	先是三藏將梵本汎海達廣州制止寺遇宰相房融知南銓聞有此經遂請對譯房融筆受
T1799_001_0137	烏長國沙門彌伽釋迦譯語翻經纔竟三藏被本國來取奉王嚴制先不許出三藏潛來邊境被責為解此難遂即去迴房融入奏
T1799_001_0138	又遇中宗初嗣未暇宣布目錄闕書時禪學者因內道場得本傳寫好而祕之遂流此地
T1799_001_0139	大通在內親遇奏經又寫隨身歸荊州度門寺有魏北舘陶沙門惠振搜訪靈迹常慕此經於度門寺遂遇此本初得科判又據開元中沙門智昇撰釋教目錄二十卷
T1799_001_0140	其第九云大佛頂首楞嚴經十卷大唐沙門懷迪於廣州譯迪循州人住羅浮山南樓寺久習經論備諳五梵因遊廣府遂遇梵僧未詳其名對文共譯勒成十卷經之題目紙數文句與今融本竝不差異
T1799_001_0141	迪筆受經旨緝綴文理等今詳二經譯人雖別譯本是同或恐迪因證義各據流行故今目錄書寫有異
T1799_001_0142	不爾豈無一處差別譯主名字何得未詳耶二本既同今解融本九通釋名題者
T1799_001_0143	大佛頂如來密因修證了義諸菩薩萬行首楞嚴經經有五名題目三號者謂該教行人理因果顯密悉具足故
T1799_001_0144	先略配者上之三字是總即一經法體總含教理行果教行明指理果
T1799_001_0145	義含明指者文云有三摩提名大佛頂此指行也又云雖蒙如來佛頂神呪又云亦說此呪名如來頂此指教也
T1799_001_0146	教有顯密顯了宣示令悟修無妄即前後諸文祕密受持令障盡功著即是呪辭義
T1799_001_0147	含者寂照含空故名為大性覺妙明等故名為佛此顯理也
T1799_001_0148	我以不滅不生合如來藏周遍法界等故名大明極即如來等故名佛
T1799_001_0149	此顯果也頂者至極無上之義也若以此三字全約理說藏體周遍無不含容
T1799_001_0150	曰大即體大靈照不昧離諸妄想曰佛佛有二義一自性顯照義即相大二隨緣現益義即用大
T1799_001_0151	此大及佛是至尊至極無上無過諸佛所師之法故名為頂
T1799_001_0152	三大之義不離一心故名一心為大佛頂如來下別顯勝能
T1799_001_0153	初八字約果人自行修證說教利他以別顯即十方如來依此法門修因證果顯了宣說究竟利他也
T1799_001_0154	諸菩薩下八字約因人修習具足自他諸行以別顯菩薩行門自利利他廣多無量此之真定咸具足故
T1799_001_0155	文殊歎云此是微塵佛一路涅槃門等次廣釋者大者當體得名常遍為義
T1799_001_0156	當體者不同法相宗棟小名大大外有小可揀猶是分限豈為至大
T1799_001_0157	今以藏體性無邊涯絕諸分量強名為大常遍者常則竪窮三世遍則橫該十方
T1799_001_0158	竪者過去無始未來無終無有一法先之唯此先於諸法故名大也
T1799_001_0159	涅槃云所言大者名之為常橫者十方窮之無有涯畔
T1799_001_0160	涅槃又云所言大者其性廣博今經常遍廣有其文仍具三義如下可見佛頂者究竟覺也覺有二義一本二始
T1799_001_0161	本謂藏體靈鑒無昧絕諸妄想具足無量性功德故起信云所言覺義者謂心體離念
T1799_001_0162	離念相者等虛空界無所不遍法界一相即是如來平等法身依此法身說名本覺
T1799_001_0163	始覺義者依本覺故而有不覺依不覺故而有始覺
T1799_001_0164	始覺是用本覺是體用合體時始本不二名究竟覺
T1799_001_0165	究竟覺者即前藏性顯現時也無上最極名之為頂此約果位以顯法體名佛頂也
T1799_001_0166	若約現事即今佛頂放光化佛所說教行是故教行俱號佛頂也
T1799_001_0167	如來者如謂本覺來謂始覺始本合故名為如來此指一佛即該諸佛
T1799_001_0168	下說教行俱約諸佛以顯同故密因者有二一教二行
T1799_001_0169	教者下說心呪是佛密語唯佛與佛乃能知之不通他解但信而受之思而持之滅障成德也
T1799_001_0170	行者以此真定具空假中即是一心非縱橫竝別不可思議具足萬行三世諸佛同此法門此行成時名三祕藏是故稱密
T1799_001_0171	修謂行因證謂克果地前地上緣真二種俱名為修
T1799_001_0172	初地妙覺分滿二果同名為證所修所證俱大佛頂此自行也
T1799_001_0173	如觀音圓通了義者說教化他詮表義理無有覆相窮理盡性稱實談故
T1799_001_0174	下文云宣勝義中真勝義性令汝會中定性聲聞皆獲一乘寂滅場地非有餘說故名了義
T1799_001_0175	諸菩薩萬行者三世因人各修其行自利利他有無量義今舉大數故名萬也
T1799_001_0176	此之三昧具斯多義故下文云有三摩提名大佛頂首楞嚴王具足萬行等
T1799_001_0177	首楞嚴者梵語也涅槃云首楞者名一切事竟嚴者名堅即一切事究竟堅固也
T1799_001_0178	得此三昧觀法如幻於法自在能破最後微細無明能獲二種殊勝之力
T1799_001_0179	現身說法無礙自在故下經中名為如幻金剛王佛母妙蓮華等
T1799_001_0180	此三昧以無分別智寂用為體以一切法皆同智性窮盡法界更無遺餘名一切事
T1799_001_0181	究竟一切事言無離染淨此智現時染淨都盡一法不立
T1799_001_0182	又染法究竟盡淨用究竟顯如下文云我以不滅不生合如來藏而如來藏唯妙覺明圓照法界是故一為無量等
T1799_001_0183	又云塵垢應念消成圓明淨妙等既觀如幻不為物壞能破無明故名堅固
T1799_001_0184	經者訓法訓常是貫是攝謂依此言說詮顯性相令物生解故稱為法
T1799_001_0185	一切諸佛皆同此說故名為常能令義理無有散失名之為貫以此化生令不顛墜稱之為攝
T1799_001_0186	若約所詮如來藏體說名經者亦具四義謂此心性諸佛所師可軌可則故名為法不生不滅無有變異故名為常
T1799_001_0187	上聖下凡情與非情無不同此故說為貫具諸功德遍含染淨故稱為攝心性既爾一切法亦然
T1799_001_0188	故下文云五陰六入生滅去來本如來藏故一切法任運有四義悉名為經
T1799_001_0189	一名中印度那爛陀大道場經於灌頂部錄出別行此別目也
T1799_001_0190	印度月名具云印特伽此云月邦以此大國形諸小國如星中月彼有五印此當中也即一境之都名
T1799_001_0191	此境之中有多國別最尊大者號摩竭提此云大體以總攝故或云不害皆義翻也
T1799_001_0192	那爛陀此云施無厭即龍名也西域記云菴沒羅國有池池中有龍名施無厭
T1799_001_0193	寺近彼池故以標號大道場者沙門體心修道之地也
T1799_001_0194	佛滅度後六帝緝興遐疎紺宇園林普合都建一門主客萬僧住持增峻印度名寺莫先於此故名曰大
T1799_001_0195	灌頂部者彼有五部此當其一毘盧為主既標部處尋檢可憑無謂近翻疑非正說
T1799_001_0196	大唐神龍元年龍集乙巳五月巳卯朔二十三日辛丑長安三年則天罷政中宗嗣位是歲改為神龍元年
T1799_001_0197	龍集者龍星亦曰歲星歲行一次也集居也乙巳即所舍之次朔蘇也月死復蘇蘇生也
T1799_001_0198	中天竺沙門般剌蜜帝於廣州制止道場譯天竺亦云乾竺乾豆身毒印度等
T1799_001_0199	沙門云勤息取生善滅惡之稱般剌蜜帝此云到彼岸
T1799_001_0200	譯者其有才智通四方語名曰象胥之學四方各有其名今取北方掌語者也
T1799_001_0201	菩薩戒弟子前正諫大夫同中書門下平章事清河房融筆授雖為宰官而受大乘戒者
T1799_001_0202	經云欲受國王位時乃至百官受位時應先受菩薩戒一切鬼神救護王身百官之身也資於師長以父兄之道事之故云弟子
T1799_001_0203	正諫者今之諫議也舉賢達能大扶進人故曰大夫
T1799_001_0204	中書門下二省之名平和章明國政之事曰平章事筆授或云筆受謂以此方文體筆其所授梵本緝綴潤色令順物情不失正理也
T1799_001_0205	烏長國沙門彌伽釋迦譯語國名未詳彌伽釋迦此云能降伏
T1799_001_0206	翻梵為華故云譯語其中證義應有別錄餘如翻譯時年中說此下第十別解文義
T1799_001_0207	准常三分謂序正流通序中二證信發起證信之立由阿難問佛令置之意為斷疑息諍及異邪故
T1799_001_0208	然此雖具六種成就今均廣略總分為二初說經時處二引眾同聞
T1799_001_0209	今初也如是若兼我聞合釋即指法之辭也如是之法我從佛聞
T1799_001_0210	佛地論云謂結集時眾共請言如汝所聞當如是說
T1799_001_0211	傳法菩薩便許可言如是當說如我所聞離釋如是者信成就也
T1799_001_0212	智度論云佛法大海信為能入智為能度信者言是事如是不信者言是事不如是
T1799_001_0213	肇公亦云信順之辭也信則所言之理順順則師資之道成故萬行中以信為首故云如是
T1799_001_0214	又契理契機曰如永離過非曰是如理而說如理而信故言如是
T1799_001_0215	若約今經如來藏心體性不動曰如真實義故曰是
T1799_001_0216	又一切諸法本無生滅皆如來藏故名為如離一切相即一切法故稱為是
T1799_001_0217	更有餘義繁而不論我聞聞成就也我即阿難自指五蘊假者然一切法佛說無我
T1799_001_0218	今稱我者我有四種一凡夫遍計二外道宗計三諸聖隨世假立賓主四法身真我經指後二非邪慢心而有所說故無過矣
T1799_001_0219	聞謂耳根發識聽受雖因耳處廢別從總故稱我聞
T1799_001_0220	無相宗說我既無我聞亦無聞從緣生故不壞假名即不聞聞也
T1799_001_0221	若約法性此經旨趣傳法菩薩以我無我不二之真我根境非一異之妙耳聞真俗無礙之法門
T1799_001_0222	一時時成就也師資合會說聽究竟總言一時一者揀異餘時
T1799_001_0223	時者隨世假立如來說經有無量時不能別舉一言略周但言一時
T1799_001_0224	涅槃經云一時在恒河岸等又諸方時分延促不定故但言一時
T1799_001_0225	若約法義釋者即說聽之時心境泯理智融凡聖如本始會此諸二法皆一之時
T1799_001_0226	佛主成就也具云佛陀此云覺者謂覺了真妄性相之者即究竟覺也
T1799_001_0227	論云以覺心源故名究竟覺未覺心源故非究竟覺
T1799_001_0228	然具三義一自覺覺知自心本無生滅二覺他覺一切法無不是如三覺滿二覺理圓稱之為滿
T1799_001_0229	佛地論中具有十義謂具一切智一切種智出煩惱障及所知障覺了一切諸法性相能自開覺亦能開覺一切有情如睡夢覺如蓮華開故稱為佛
T1799_001_0230	在室羅筏城祇桓精舍處成就也處有二種一所化處即伐城二所住處即祇園具云
T1799_001_0231	室羅伐悉底此云豐德或云聞物或云好道此乃城名非是國號以其城中多財物好欲境饒多聞豐解脫道德名稱五天共聞故
T1799_001_0232	或云聞者城昔有老仙於此修道後有少仙從其受學厥號聞者老仙歿後少仙於此建城而住故以名焉
T1799_001_0233	國都號為憍薩羅但以就勝易彰故舉城號祇桓者具云祇陀或云逝
T1799_001_0234	多制多此云戰勝即太子名林主是彼故云勝林桓即林也
T1799_001_0235	精舍者即沙門精行所舍處也謂須達買園置舍太子捨樹造門二人共搆以延僧佛
T1799_001_0236	二引眾同聞者同聞之眾匪唯三乘亦該諸趣下具天龍八部王臣菩薩發起序中今文但有二類蓋譯之巧略也
T1799_001_0237	文二一聲聞二緣覺初文三一標類舉數與大比丘眾標類也
T1799_001_0238	與者并兼共及也佛與阿難及大比丘等證非虛謬
T1799_001_0239	梵云摩訶此具三義謂大多勝也器量尊重為天王大人之所恭敬故云大
T1799_001_0240	遍知內外經書故言多勝出九十五種外道故言勝比丘名含三義乞士怖魔破惡
T1799_001_0241	謂出家者上於諸佛求法以內資令慧命增長下於檀越離邪正命乞食以外資令色身無損故云乞士
T1799_001_0242	又出家者最初發出家心或菩提心或至成道皆令魔怖失人眾故名為怖魔
T1799_001_0243	又能破斷身口七支九十八使業煩惱故稱為破惡
T1799_001_0244	四人已上乃至無量能作說恣羯磨法故名為眾矣千二百五十人俱舉數也
T1799_001_0245	佛初成道先度陳如等五人次度三迦葉兄弟兼徒總一千
T1799_001_0246	次度舍利弗目連各兼徒一百次度耶舍長者等五十人經舉大數故減五人
T1799_001_0247	此眾先竝事外勤苦累劫一無所證纔遇見佛便得上果感佛恩深常隨佛化為常隨眾也
